{
  "$schema": "https://raw.githubusercontent.com/MaayanLab/jupyter-template-catalog/master/schema/template-validator.json",
  "name": "Bulk_RNA_seq",
  "title": "Bulk RNA-seq analysis pipeline",
  "version": "0.0.1",
  "description": "Bulk RNA-seq analysis pipeline enables you to analyze and visualize datasets with state-of-the-art algorithms and visualization methods.",
  "authors": [
    {
      "name": "Minji Jeon",
      "email": "minji.jeon1@gmail.com"
    }
  ],
  "url": "https://github.com/MaayanLab/jupyter-template-catalog",
  "tags": [
    "RNAseq"
  ],
  "license": "Apache-2.0",
  "template": {
    "file": "RNA_seq_Analysis_Pipeline_Template.ipynb",
    "profile": "biojupies"
  }
}
